اسم فایل,صورت سوال,پاسخ,گزینه ۱,گزینه ۲,گزینه ۳,گزینه ۴
http://Alefba-347359147951-15_Omoomi_Sample_Etelat_Omomi1__estekhdamshoo.ir,نخستین نیروگاه هسته‌ای (تولید برق) ایران در کجا و در ابتدا توسط کدام کشور تأسیس گردید؟,2,نطنز - آلمان,بوشهر - آلمان,نطنز - شوروی سابق,بوشهر - شوروی سابق
https://hamid737.blogsky.com/1390/11/22/post-15/,«زبان پهلوی» نام دیگرکدامیک از مراحل زبان فارسیاست؟,2,فارسی باستان,فارسی میانه,فارسی نو,فارسی دری
https://irancontent.net/common-general-knowledge-test/,O3 در هوا چیست؟,1,اوزون,اکسیژن,,
https://barandehshoo.ir/landingpage/general-information-test-question/,آرامگاه فردوسی در کدام شهر است؟,2,شیراز,طوس,نیشابور,مشهد
Alefba-823799147951-91_Omoomi_Sample_Etelat_Omomi4__estekhdamshoo.ir.docx,هر یک از نمایندگان مجلس شورای اسلامی در برابر ................ مسئول می‌باشد.,3,شورای نگهبان,دولت,تمام ملت,رئیس مجلس
Alefba-823799147951-91_Omoomi_Sample_Etelat_Omomi4__estekhdamshoo.ir.docx,سازمان کشورهای صادرکننده نفت کدام است؟,4,ایکو,آنروا,ایمکو,اوپک
http://teacherofhistory.blogfa.com/post/932,ماني از نخستين كساني بود كه به اهميت ...................................... در آموزش پي برد.,3,گوش كردن,تجربه,تصاوير,خواندن
https://barandehshoo.ir/landingpage/general-information-test-question/,پایتخت ترکیه کدام شهر است؟,2,استانبول,آنکارا,ازمیر,بورسا
Alefba-823799147951-91_Omoomi_Sample_Etelat_Omomi4__estekhdamshoo.ir.docx,بر طبق قانون اساسی، گرفتن و دادن وام یا کمک‌های بدون عوض داخلی و خارجی از طرف دولت ...,1,با تصویب مجلس شورای اسلامی مجاز است.,با تصویب هیئت وزیران مجاز است.,بلامانع است.,ممنوع است.
https://icdl.blogsky.com/1387/03/02/post-1/,به واحد اندازه گیری سرعت دریافت و ارسال اطلاعات از طریق مودم .... گفته می شود.,3,Byte,Hertz,Baud Rate,MHZ
Alefba-823799147951-91_Omoomi_Sample_Etelat_Omomi4__estekhdamshoo.ir.docx,حمله نظامی آمریکا به طبس در ................ ماه سال .............. اتفاق افتاد.,2,تیر ۱۳۵۹,اردیبهشت ۱۳۵۹,تیر ۱۳۵۸,اردیبهشت ۱۳۵۸
Alefba-960269147951-62_Omoomi_Sample_Etelat_Omomi4__estekhdamshoo.ir,بزرگترین صادر کننده گندم در جهان کدام کشور است؟,3,فرانسه,انگلیس,آمریکا,استرالیا
http://teacherofhistory.blogfa.com/post/940,در زمان کدام شاه ساسانی یمن به تصرف ایران درآمد؟,2,شیرویه,انوشیروان,کواذ,یزدگرد
http://Alefba-347359147951-15_Omoomi_Sample_Etelat_Omomi1__estekhdamshoo.ir,آغاز غنی‌سازی اورانیوم در کدام مرکز ایران و توسط کدام رئیس دولت اعلام شد؟,2,در سال ۲۰۰۲ در بوشهر - حجت‌الاسلام خاتمی,در سال ۲۰۰۷ میلادی در نطنز و توسط محمود احمدی‌نژاد,سال ۱۹۹۳ در نطنز - آیت‌الله هاشمی رفسنجانی,سال ۲۰۰۹ در بوشهر - محمود احمدی‌نژاد
http://Alefba-347359147951-15_Omoomi_Sample_Etelat_Omomi1__estekhdamshoo.ir,آغاز و پایان جنگ تحمیلی چه سال‌هایی بود؟,3,۱۳۶۹ - ۱۳۵۹ ,۱۳۶۸ - ۱۳۶۰ ,۱۳۶۷ - ۱۳۵۹ ,۱۳۶۸ - ۱۳۵۹ 
Alefba-960269147951-62_Omoomi_Sample_Etelat_Omomi4__estekhdamshoo.ir, در مقایسه با سایر کشورهای جهان :,2,ایران بزرگترین تولید کننده نفت و گاز است.,ایران دومین رتبه را از جهت ذخائر گاز دارد.,ایران بزرگ ترین صادر کننده نفت و گاز است.,ایران دومین رتبه را از جهت مصرف نفت خام در دنیا دارد.
http://teacherofhistory.blogfa.com/post/909,منشأ خط پهلوی اشکانی .................. بود.,1,آرامی,میخی,هیروگلیف,سومری
Alefba-960269147951-62_Omoomi_Sample_Etelat_Omomi4__estekhdamshoo.ir,مرکز استان چهار محال بختیاری کجاست؟,3,زاهدان,یاسوج,شهرکرد,سنندج
https://barandehshoo.ir/landingpage/general-information-test-question/,کدام ورزشکار رکورد دار بیشترین مدال در تاریخ المپیک است؟,4,یوسین بولت,حسین رضازاده,بن جانسن,مایکل فلپس
http://teacherofhistory.blogfa.com/post/964,دانش مصریان در اختیار کدام گروه از افراد زیر قرار داشت؟,3,فرعون ها,دبیران,کاهنان,رؤسای ادارات
Alefba-960269147951-62_Omoomi_Sample_Etelat_Omomi4__estekhdamshoo.ir,»Talweg» تالوگ چیست؟,1,خطی که از میان عمیقترین نقطه بستر رودخانه بین المللی عبور و مرز را مشخص می کند.,خطی که رودخانه بین المللی را به دو بخش تقسیم و مرز را تعیین می کند.,خطی فرضی که بستر رودخانه را به دو نیم تقسیم و مرز را معین می کند.,خطی فرضی که مرز رودخانه بین المللی را مشخص می کند.
http://Alefba-347359147951-15_Omoomi_Sample_Etelat_Omomi1__estekhdamshoo.ir,در جنگ جهانی دوم گروه کشورهای متفق (متفقین) که پیروز شدند، کدام کشورها بودند؟,4,شوروی، آلمان، ایتالیا,ژاپن، آمریکا، انگلیس,ایتالیا، آلمان، انگلیس,شوروی آمریکا، انگلیس، فرانسه
Alefba-823799147951-91_Omoomi_Sample_Etelat_Omomi4__estekhdamshoo.ir.docx,در کدام کشور کودتای نظامی اتفاق نیفتاده است؟,4,ترکیه,يونان,عراق,اردن
http://teacherofhistory.blogfa.com/post/967,استفاده از آجرهای لعاب دار نخستین بار توسط چه کسانی ابداع شد؟,1,ماد,هخامنشیان,ایلام,مصریان
http://teacherofhistory.blogfa.com/post/894,شعار اسکندر مقدونی هنگام راهی شدن به ایران چه بود؟,1,انتقام گرفتن یونانیان از ایرانیان,انتقام گرفتن رومیان از ایرانیان,تصرف سراسر جهان,از بین بردن حکومت هخامنشی
http://teacherofhistory.blogfa.com/post/822,اداره دولت شهرهاي سومر برعهده چه كسي بود؟,2,موبد,انسي,مغ,كاهن
http://Alefba-347359147951-15_Omoomi_Sample_Etelat_Omomi1__estekhdamshoo.ir,ریاست شورای عالی امنیت ملی برعهده چه کسی است؟,2,وزیر کشور,رئیس جمهور,رئیس مجلس,رئیس دیوان عالی کشور
Alefba-960269147951-62_Omoomi_Sample_Etelat_Omomi4__estekhdamshoo.ir,داد و ستد بین مردم در جوامع اولیه به صورت کالا به کالا صورت می گرفته، که این شیوه مبادله کدام یک ازحالات زیر است؟,1,مبادله پایاپای, مبادله ابتدایی,مبادله غیر ارزشی,مبادله کالایی
Alefba-823799147951-91_Omoomi_Sample_Etelat_Omomi4__estekhdamshoo.ir.docx,لقب «ام‌ابیها» را پیامبر به چه کسی داده بودند؟,1,حضرت زهرا (س),حضرت خدیجه,آمنه,زنان مسلمان
http://teacherofhistory.blogfa.com/post/839,كدام گزينه زير صحيح نيست؟,3,به شرح فتوحات فرعون سالنامه مي گفتند .,شهرت تمدن مصر بيش از هر چيز به خاطر ميراث های فرهنگي آن است.,ميراث هاي فرهنگي مصر شامل اسطوره ها و خدايان مي باشد.,عوامل طبيعي و سارقان از جمله دشمنان ميراث ها ي فرهنگي مصر مي باشند.
http://Alefba-347359147951-15_Omoomi_Sample_Etelat_Omomi1__estekhdamshoo.ir,نحوه انتخاب اعضای حقوق‌دان شورای نگهبان چگونه است؟,3, به پیشنهاد رئیس جمهور و انتخاب مجلس خبرگان,به پیشنهاد فقهای شورای نگهبان و انتخاب رهبر, به پیشنهاد رئیس قوه قضائیه و انتخاب مجلس شورای اسلامی,به پیشنهاد رئیس مجلس شورای اسلامی و انتخاب نمایندگان مجلس شورای اسلامی
Alefba-823799147951-91_Omoomi_Sample_Etelat_Omomi4__estekhdamshoo.ir.docx,جایزه صلح نوبل در سال ۱۹۷۷ به سازمان ............. تعلق گرفت.,2,حقوق بشر,عفو بین المللی,صلیب سرخ جهانی,یونسکو
http://teacherofhistory.blogfa.com/post/930,صابئن چه كساني هستند؟,1,پيروان حضرت يحيي(ع),پيروان حضرت عيسي(ع),پيروان حضرت زكريا(ع),پيروان حضرت نوع(ع)
Alefba-823799147951-91_Omoomi_Sample_Etelat_Omomi4__estekhdamshoo.ir.docx,شاه در چه تاریخی از ایران فرار کرد؟,3,۲۳ دی ۵۷,۱ بهمن ۵۷,۲۶ دی ۵۷,۱۶ آذر ۱۳۳۲
http://Alefba-347359147951-15_Omoomi_Sample_Etelat_Omomi1__estekhdamshoo.ir,جدیدترین تکنولوژی ارتباطی نوین کدام است؟,2,تلکس,کامپیوتر,ماهواره,تلماتیک
Alefba-960269147951-62_Omoomi_Sample_Etelat_Omomi4__estekhdamshoo.ir,کشور غیر آسیایی عضو اوپک کدام است؟,2,برزیل,ونزوئلا,کانادا,الجزایر
http://teacherofhistory.blogfa.com/post/840,حدود چند هزار سال از عمر خط می گذرد؟,4,2000سال,3000سال,4000سال,5000سال
http://Alefba-347359147951-15_Omoomi_Sample_Etelat_Omomi1__estekhdamshoo.ir,کدام کشور اولین ماهواره را به مدار زمین فرستاد؟,1,شوروی سابق,آمریکا,فرانسه,انگلستان
98-Omoomi-Sample(Modiriat Omomi5)-estekhdamshoo.ir.pdf,کدام یک از نگرش های مدیریتی، سازمان را به شکل یک کل می نگرد؟,3,اداری ,علمی ,سیستمی ,بروکراسی 
https://barandehshoo.ir/landingpage/general-information-test-question/,بریانی غذای معروف کدام شهر است؟,2,یزد,اصفهان,تبریز,مشهد
https://icdl.blogsky.com/1387/03/02/post-1/,.... به اجزاء مختلفی اطلاق میشود که با هماهنگی کارمی کنند و هدف واحدی را دنبال می نمایند,1,سیستم,سخت افزار,برنامه,میان افزار
http://teacherofhistory.blogfa.com/post/874,زيگورات چغازنبيل مربوط به كدام قوم مي باشد؟,2,سومر,ايلام,ماد,اشكاني
https://test-drive.ir/سوالات-فنی-آیین-نامه-رانندگی/,مبدل کاتالیستی در کجا قرار دارد و چهکاری انجام می دهد ؟,3,شمع- توان موتور راافزاریش میدهد,شمع-گازهای مضر را به گاز بیضرر تبدیل میکند.,اگزوز- گازهای مضر را بهگاز بی ضرر تبدیل میکند.,اگزوز-صداینابهنجار را کاهشمیدهد
https://barandehshoo.ir/landingpage/general-information-test-question/,بزگترین صنعت جهان کدام است؟,2,الکترونیک,خودرو سازی,فولاد,نفت
https://irancontent.net/common-general-knowledge-test/,کدام یک از موارد زیر نام یک اقیانوس نیست؟,3,آرام,هند,بزرگ,
https://icdl.blogsky.com/1387/03/02/post-1/,اگر در حال کار با کامپیوتر در خانه میباشید به وسیله ی کدامیک از موارد زیر میتوانید با همکاران خود در حین کار ارتباط برقرار نمایید؟,2,برنامه ارائه مطلب Presentation,پست الکترونیکی(Electronic mail (e-mail,بانک اطلاعاتیDatabase,صفحه گسترده- Spreadsheet
Alefba-823799147951-91_Omoomi_Sample_Etelat_Omomi4__estekhdamshoo.ir.docx,کدام شهر از بقیه پرجمعیت‌تر است؟,1,کرمانشاه,رشت,زاهدان,ارومیه
Alefba-960269147951-62_Omoomi_Sample_Etelat_Omomi4__estekhdamshoo.ir,نزدیکترین سیاره منظومه شمسی به زمین کدام است؟,3,مشتری,کیوان,زهره,تیر
Alefba-960269147951-62_Omoomi_Sample_Etelat_Omomi4__estekhdamshoo.ir,بیشترین و کوتاه ترین مرزهای خشکی ایران به ترتیب باکدام کشورها است؟,1,عراق – ارمنستان,ترکیه – آذربایجان,ترکمنستان – افغانستان,پاکستان – عراق
Alefba-823799147951-91_Omoomi_Sample_Etelat_Omomi4__estekhdamshoo.ir.docx,«امامعلی رحمانف» رئیس جمهوری چه کشوری است؟ (۱۳۷۶),3,قرقیزستان,ازبکستان,تاجیکستان,قزاقستان
Alefba-960269147951-62_Omoomi_Sample_Etelat_Omomi4__estekhdamshoo.ir,مقر ناتو « سازمان پیمان آتلانتیک شمالی » کدام کشور است؟,1,بلژیک (شهر بروکسل),آمریکا (شهر واشنگتن),انگلیس (شهر لندن)," فرانسه (شهر پاریس)
"
Alefba-960269147951-62_Omoomi_Sample_Etelat_Omomi4__estekhdamshoo.ir, کدام عالم روحانی ماده واحده متمم قانون اساسی به مجلس ارائه داد؟,1,شیخ فضل ا... نوری,آیت ا... شیرازی,آیت ا... بهبهانی,آیت ا... طباطبایی
Alefba-823799147951-91_Omoomi_Sample_Etelat_Omomi4__estekhdamshoo.ir.docx,پرجمعیت ترین کشور جهان کدام است؟,3,آمریکا,هند,چین,برزیل
http://teacherofhistory.blogfa.com/post/904,خدای آبهای روان در دوره اشکانی چه نام داشت؟,2,اهورا مزدا,آناهیتا,میترا,امردات
http://Alefba-347359147951-15_Omoomi_Sample_Etelat_Omomi1__estekhdamshoo.ir,«جبهه اقدام اسلامی» در کدام کشور فعالیت دارد؟,1,افغانستان,عربستان,اردن,یمن
Alefba-823799147951-91_Omoomi_Sample_Etelat_Omomi4__estekhdamshoo.ir.docx,طویل ترین رود جهان در کدام قاره قرار دارد؟,1,آفریقا,آسیا,اروپا,آمریکا
https://iranestekhdam.ir/نمونه-سوالات-استخدامی-رایگان-اطلاعات/,کدام گزینه درمورد وضع کشورژاپن، در دو جنگ جهانی صحیح است؟,3,در هر دو جنگ متحد آلمان بود.,درهردو جنگ مخالف آلمان بود.,در جنگ جهانی اول علیه آلمان و در جنگجهانی دوم متحد آلمان بود.,درجنگ جهانی اول متحدآلمان ودرجنگ جهانی دومعلیه آلمان بود.
https://icdl.blogsky.com/1387/03/02/post-1/,UPS دستگاهی است که ...,3,یک وسیله برای انجام بازی های کامپیوتری است.,از آن برای انتقال اطلاعات استفاده می شود.,به هنگام قطع جریان برق به طور خودکار جریان برق خود را بلافاصله جایگزین برق شهر می کند تا اطلاعات جریان برق از بین,وسیله ای است برای پردازش داده ها
http://Alefba-347359147951-15_Omoomi_Sample_Etelat_Omomi1__estekhdamshoo.ir,"کدام اصل قانون اساسی جمهوری اسلامی ایران، نظام اقتصادی را بر پایه سه بخش دولتی، تعاونی و خصوصی
با برنامه ریزی منظم و صحیح استوار می‌داند؟",2,اصل ۴۳,اصل ۴۴, اصل ۴۵, اصل ۴۹
https://irancontent.net/common-general-knowledge-test/,برلین پایتخت کدام کشور است؟,1,آلمان,اسپانیا,استرالیا,
Alefba-960269147951-62_Omoomi_Sample_Etelat_Omomi4__estekhdamshoo.ir,پدر علم هواشناسی ایران « بنیان گذار جغرافیای نوین کشور » کیست؟,4,دکتر حسابی,دکتر ایرج ملک پور,دکتر محمد معین,پرفسور محمد حسن گنجی
Alefba-960269147951-62_Omoomi_Sample_Etelat_Omomi4__estekhdamshoo.ir,طرحهای قانونی به پیشنهاد چند نفر از نمایندگان ، در مجلس شورای اسلامی قابل طرح است؟,3,25 نفر,20 نفر,15 نفر,10 نفر
https://iranestekhdam.ir/نمونه-سوالات-استخدامی-رایگان-اطلاعات/,قیام موسوم به تنباکو در زمان کدام پادشاه قاجار صورت گرفت؟,2,آقامحمدخان,ناصرالدین شاه,مظفرالدین شاه,محمدعلی شاه
Alefba-960269147951-62_Omoomi_Sample_Etelat_Omomi4__estekhdamshoo.ir,مرجع انتخاب حقوقدانان ..................  و فقهای شورای نگهبان .................. می باشد.,3,مجلس شورای اسلامی – رئیس قوه قضائیه,رئیس قوه قضائیه – مقام معظم رهبری,ا معرفی رئیس قوه قضائیه و با انتخاب مجلس شورای اسلامی - مقام معظم رهبری,مجمع تشخیص مصلحت نظام - مجلس شورای اسلامی
Alefba-823799147951-91_Omoomi_Sample_Etelat_Omomi4__estekhdamshoo.ir.docx,پس از مرگ استالین چه فردی نخست وزیر شوروی شد؟,2,بوخارین,مالنکوف,خروشچف,ژوکف
http://teacherofhistory.blogfa.com/post/905,مورخان مسلمان حکومت اشکانی را چه نامیدند؟,3,حکومت مستقل,حکومت مقتدر مرکزی,حکومت ملوک الطوایفی,حکومت نیمه مستقل
Alefba-960269147951-62_Omoomi_Sample_Etelat_Omomi4__estekhdamshoo.ir,مقر پاپ رهبر کاتولیک های جهان در چه شهری است؟,4,ژنو, برن,وین,واتیکان
https://test-drive.ir/سوالات-فنی-آیین-نامه-رانندگی/,ترمز دستی به عنوان ترمز……..شناختهمیشود.,2,اولیه,ثانویه,سرویس,مورد ۱و۳
Alefba-960269147951-62_Omoomi_Sample_Etelat_Omomi4__estekhdamshoo.ir, اگر بانک مرکزی برای مقید کردن نرخ ارز دخالت کند ، این عمل چه نامیده می شود؟,1,سیستم تثبیت ارز,سیستم ارز شناور,سیستم شناوری کنترل شده,سیستم شناوری آزاد
http://Alefba-347359147951-15_Omoomi_Sample_Etelat_Omomi1__estekhdamshoo.ir,عملیات والفجر ۸ در چه تاریخ و در کدام منطقه عملیاتی انجام شد؟,1,۶۴/۱۱/۲۰ - فاو,۶۲/۴/۲۹ - حاج‌عمران,۶۴/۱۲/۵ - چوارته عراق,۶۲/۵/۷ - مهران
Alefba-823799147951-91_Omoomi_Sample_Etelat_Omomi4__estekhdamshoo.ir.docx,هفته نامه «سیروان» به چه زبانی انتشار می یابد؟,2,عربی,کردی,آذری,ترکمنی
Alefba-823799147951-91_Omoomi_Sample_Etelat_Omomi4__estekhdamshoo.ir.docx,تعداد اعضای شورای نگهبان .............. نفر است.,4,شش,هشت,ده,دوازده
https://test-drive.ir/سوالات-فنی-آیین-نامه-رانندگی/,در چه زمانی توصیه میشود فیلتر روغنتعویض گردد ؟,3,هربار تعویض روغن,هر ۲۰ هزار کیلومتر,هر ۱۰ هزار کیلومتر,هر ۱۵ هزارکیلومتر
https://irancontent.net/common-general-knowledge-test/,واحد پول کشور ژاپن کدام است؟,2,یوان,یِن,تاکا,
https://barandehshoo.ir/landingpage/general-information-test-question/,کدام یک از گزینه های زیر، از شهدای هسته ای نمی باشد؟,3,شهید رضاعینژاد,شهیدعلیمحمدی,شهید تهرانیمقدم,شهیدشهریاری
http://Alefba-347359147951-15_Omoomi_Sample_Etelat_Omomi1__estekhdamshoo.ir,"تطبیق مصوبات مجلس شورای اسلامی با دستورات اسلام طبق قانون اساسی برعهده چه کسی یا نهادی
است؟",3,مقام معظم‌رهبری ,ریاست جمهوری,شورای نگهبان,مجلس خبرگان
Alefba-960269147951-62_Omoomi_Sample_Etelat_Omomi4__estekhdamshoo.ir,پیامبر (ص) معمولاً در چه ماه هایی در غار حراء به عبادت می پرداخت؟,1,شعبان و رمضان,رجب و رمضان,محرم و صفر,شوال و ذیقعده
Alefba-960269147951-62_Omoomi_Sample_Etelat_Omomi4__estekhdamshoo.ir,شورای امنیت سازمان ملل متحد در حال حاضر دارای :,4,9عضواست،5عضودائمی+4عضوغیردائمی,11 عضو است، 5 عضو دائمی + 6 عضو غیر دائمی,15 عضو است، 5 عضو دائمی + 5 عضو غیر دائمی + 5 عضو علی البدل,15 عضو است، 5 عضو دائمی + 10 عضو غیر دائمی
https://irancontent.net/common-general-knowledge-test/,پایتخت کانادا کدام است؟,1,اوتاوا,تورانتو,بوستون,
Alefba-823799147951-91_Omoomi_Sample_Etelat_Omomi4__estekhdamshoo.ir.docx,امام علی (ع) در چه تاریخی به شهادت رسید؟,4,۲۱ رمضان ۳۹ هجری,۱۹ رمضان ۴۰ هجری,۱۹ رمضان ۳۹ هجری,۲۱ رمضان ۴۰ هجری
Alefba-960269147951-62_Omoomi_Sample_Etelat_Omomi4__estekhdamshoo.ir,انعقاد قرارداد نفتی با شرکت امریکایی استاندارد اویل باعث سقوط کدام نخست وزیر گردید؟,2,مشیرالدوله,قوام السلطنه,سید ضیاءالدین طباطبایی,ساعد مراغه ای
https://irancontent.net/common-general-knowledge-test/,کدام پستاندار توانایی پریدن را ندارد؟,1,فیل,زرافه,کانگورو,
alefba-002248376951-99_omoomi_sample_modiriat_omomi6__estekhdamshoo,کدام گزینه زیر موجب ناهماهنگی، انحراف از هدف، اتلاف وقت و انرژی می شود و سازمانها را به نابسامانی می کشاند؟,2,ساختار چندگانه,فقدان مدیریت,عدم رسمیت,
Alefba-823799147951-91_Omoomi_Sample_Etelat_Omomi4__estekhdamshoo.ir.docx,«تفلیس» پایتخت کدام کشور است؟,1,گرجستان,ترکمنستان,ارمنستان,قرقیزستان
https://test-drive.ir/سوالات-فنی-آیین-نامه-رانندگی/,روغن جعبه دنده (گیربکسیا واسکازین)هر چند کیلومتر پیمایش نیاز بهتعویض دارد ؟,1,هر ۳۰ هزار کیلومتر,هر ۲۰ هزار کیلومتر,هر ۴۰ هزار کیلومتر,هر ۵۰ هزارکیلومتر
Alefba-823799147951-91_Omoomi_Sample_Etelat_Omomi4__estekhdamshoo.ir.docx,کنوانسیون (Convention) عبارتست از:,4,قرارداد,پیمان,عهدنامه,هر سه
Alefba-960269147951-62_Omoomi_Sample_Etelat_Omomi4__estekhdamshoo.ir,کدام یک از کشورهای زیر جزء سازمان همکاری های اقتصادی « اکو » نمی باشد؟,4,ایران,افغانستان,تاجیکستان,عراق
Alefba-823799147951-91_Omoomi_Sample_Etelat_Omomi4__estekhdamshoo.ir.docx,اولین مجلس قانونگذاری در زمان کدام شاه قاجار تشکیل شد؟,1,مظفرالدین شاه,محمد شاه,ناصرالدین شاه,احمدشاه
Alefba-823799147951-91_Omoomi_Sample_Etelat_Omomi4__estekhdamshoo.ir.docx,در جمهوری اسلامی ایران، امضای قراردادهای بین‌المللی (پس از تصویب مجلس شورای اسلامی) با کدام مرجع است؟,3,رئیس مجلس شورای اسلامی,رئیس مجمع تشخیص مصلحت نظام,رئیس جمهور یا نماینده قانونی او,مقام رهبری
http://teacherofhistory.blogfa.com/post/965,علت آگاهی اندک ما از تمدن ایلام در مقایسه با میان دو رود چیست؟,2,نداشتن خط و زبان,کشف نشدن رموز خط و زبان ایلام,نداشتن کتاب مقدس,انجام ندادن کاوش های باستانی
Alefba-960269147951-62_Omoomi_Sample_Etelat_Omomi4__estekhdamshoo.ir,مفهوم دو اصطلاح « آنارشیسم و لائیک » در کدام گزینه بیان شده است؟,2,تجدد گرایی - بدون دین و مذهب,نداشتن حکومت – بدون دین و مذهب,آزادی خواهی – تجدد گرایی,آزادی خواهی – جدایی دین از سیاست
https://iranestekhdam.ir/نمونه-سوالات-استخدامی-رایگان-اطلاعات/,نحوه انتخاب فقهای شورای نگهبان چگونه است؟,1,بامعرفی رییس قوه قضائیه و تاییدمقام رهبری,با معرفی رییس قوه قضائیهوتایید مجلس شورای اسلامی,با انتخاب و معرفی مقام رهبری,با انتخاب مجلس شورایاسلامی
http://teacherofhistory.blogfa.com/post/852,عصر رقابت سياسي با آشور كدام دوره تاريخي ايلام مي باشد؟,۴,ايلام نخستين,ايلام ميانه,ايلام قديم,ايلام نو
