اسم فایل,صورت سوال,پاسخ,گزینه ۱,گزینه ۲,گزینه ۳,گزینه ۴
Alefba-960269147951-62_Omoomi_Sample_Etelat_Omomi4__estekhdamshoo.ir,سیاست « نرخ ارز » به وسیله .............. اجرا می شود.,2,سیستم بانکی,بانک مرکزی,خزانه,دولت
Alefba-823799147951-91_Omoomi_Sample_Etelat_Omomi4__estekhdamshoo.ir.docx,«یونسکو» (سازمان آموزشی، علمی و فرهنگی ملل متحد در چه سالی تأسیس شد؟,4,۱۹۵۱,۱۹۴۸,۱۹۵۰,۱۹۴۶
http://Alefba-347359147951-15_Omoomi_Sample_Etelat_Omomi1__estekhdamshoo.ir,«مجمع تشخیص مصلحت نظام» در چه سالی تأسیس شد؟,1,۱۳۶۶,۱۳۶۵,۱۳۶۴,۱۳۶۶
Alefba-960269147951-62_Omoomi_Sample_Etelat_Omomi4__estekhdamshoo.ir,هشتم شهریور سال 1360 کدام یک از وقایع زیر روی داده است؟,4,تشکیل بسیج مستضعفین,انفجار دفتر حزب جمهوری اسلامی,آزاد سازی آبادان از محاصره نیروهای بعثی,انفجار دفتر نخست وزیری و شهادت شهید رجایی و دکتر باهنر
https://barandehshoo.ir/landingpage/general-information-test-question/,کدامیک از شهدای جنگ تحمیلی در سمت شهردار ارومیه بودهاست؟,1,شهید مهدیباکری,شهید کلاهدوز,شهید باقری,شهید جهانآرا
Alefba-823799147951-91_Omoomi_Sample_Etelat_Omomi4__estekhdamshoo.ir.docx,کتاب «آیین شهرداری» در قرن هفتم هجری نوشته کیست؟,1,ابن اخوه,ابن خلدون,ابن سینا,ابن عربی
http://teacherofhistory.blogfa.com/post/892,از هنریونان باستان کدام شهرت بیشتری دارند؟,4,سکه ها و گچ بری,کاخ ها و معابد,سلاح ها و پادگانها,معماری و مجسمه ساز ی
Alefba-823799147951-91_Omoomi_Sample_Etelat_Omomi4__estekhdamshoo.ir.docx,«الکساندر دوبچک» رهبر سیاسی چه کشوری بود؟,4,رومانی,مجارستان,لهستان,چکسلواکی
Alefba-960269147951-62_Omoomi_Sample_Etelat_Omomi4__estekhdamshoo.ir, کدامیک از فیلسوفان ارزشمند ایرانی ملقّب به« معلّم ثانی » است؟,3,شیخ بهاءالدین سهروردی,ابوسعید ابوالخیر, ابونصر فارابی,ابوعلی سینا
Alefba-823799147951-91_Omoomi_Sample_Etelat_Omomi4__estekhdamshoo.ir.docx,مصوبه جلسه غیر علنی مجلس شورای اسلامی باید به تصویب ................ برسد.,2,دو سوم مجموع نمایندگان,سه چهارم مجموع نمایندگان,۱۷۰ نفر نمایندگان,۲۲۰ نفر نمایندگان
http://teacherofhistory.blogfa.com/post/968,نقوشی با موضوع ها نبرد پلنگ با مار ، مار با عقاب و ... مربوط به کدام تمدن می باشد؟,3,سومر,جیرفت,ایلام,"مصر"""
https://barandehshoo.ir/landingpage/general-information-test-question/,نویسنده کدام یک از این کتاب ها، همان نویسنده ی کتاب بابالنگ دراز است؟,1,دشمن عزیز,ندایی از درون,سایه جولی,آنشرلی
https://iranestekhdam.ir/نمونه-سوالات-استخدامی-رایگان-اطلاعات/,براساس قانون اساسی جمهوری اسلامی ایران،اداره امورکشور بر مبنای کدام گزینه زیرصورت می پذیرد؟,3,با اتکاء به دستورهای مقامرهبری,بااتکاءبه اجماع قوای سه گانه,بااتکاءبه آرا عمومی و از راه انتخاب,اتکا به مشورت و براساسآیه شریفه«وامرهم شورایبینهم
Alefba-960269147951-62_Omoomi_Sample_Etelat_Omomi4__estekhdamshoo.ir,کدام نهاد تصویب قوانین توسط مجلس را از لحاظ انطباق آن با شرع و قانون بررسی می کند؟,1,شورای نگهبان,شورای انقلاب اسلامی,هیأت دولت,مجلس خبرگان
Alefba-960269147951-62_Omoomi_Sample_Etelat_Omomi4__estekhdamshoo.ir,"مرام تعدیل ثروت و جلوگیری از تمرکز سرمایه در دست عده معدود و سهیم ساختن مردم در منافع «
اجتماعی» چه نام دارد؟ ",4,رئالیسم,ناسیونالیسم,اید ه آلیسم,سوسیالیسم
Alefba-823799147951-91_Omoomi_Sample_Etelat_Omomi4__estekhdamshoo.ir.docx,کدامیک از موارد زیر از اختیارات هیئت وزیران است؟,3,تصویب صلح دعاوی راجع به اموال عمومی,تصویب لوایح قانونی جهت ارائه به مجلس شورای اسلامی,هر دو مورد,هیچکدام
Alefba-960269147951-62_Omoomi_Sample_Etelat_Omomi4__estekhdamshoo.ir,پول کاغذی برای اولین بار توسط چه کسانی رایج شد؟,4,انگلیسی ها,بانک ها,حاکمان و دولت مردان,صرافان و تاجران
Alefba-823799147951-91_Omoomi_Sample_Etelat_Omomi4__estekhdamshoo.ir.docx,رئیس جمهور برای مدت چند سال انتخاب می‌شود؟,2,۳ سال,۴ سال,۶ سال,۵ سال
https://barandehshoo.ir/landingpage/general-information-test-question/,رمان بی نوایان اثر کیست؟,1,ویکتور هوگو,گابریل گاریسامارکس,جورج اورول,ارنسن همینگوی
Alefba-960269147951-62_Omoomi_Sample_Etelat_Omomi4__estekhdamshoo.ir,"مهم ترین ابزار دیپلماسی که مبتنی بر گفتگو و مذاکره است و وسیله ای که هر کشوری هر چند ضعیفبرای تفهیم مواضع خود به طرف مقابل آن بکار می گیرد چه نام دارد؟",2,افشاء,اقناع,پیشنهاد پاداش,تهدید به مجازات
http://teacherofhistory.blogfa.com/post/917,چه كساني در سختگيري پادشاهان ساساني نسبت به مسيحيان ايران دخالت داشتند؟،,2,حاكمان ايالات,موبدان زرتشتي,مغ ها,يهوديان ايران
Alefba-960269147951-62_Omoomi_Sample_Etelat_Omomi4__estekhdamshoo.ir,« حوزه علمیه قم » به همت چه کسی تأسیس شد؟,3,آیت ا... حسین بروجردی,آیت ا... سید تقی خوانساری,آیت ا... عبدالکریم حائری,آیت ا... عبدالله بهبهانی
http://teacherofhistory.blogfa.com/post/951,مانی در زمان کدام شاه ساسانی ظهور کرد؟,1,شاپور اول,خسرو پرویز,بهرام گور,شیرویه
Alefba-428990247951-Zaban96__konkur.in_," بیت زیر، با کدام بیت قرابت مفهومی دارد؟
می بهشت ننوشم ز جام ساقی رضوان   مرا به باد چه حاجت که مست بوی تو باشم»",3,سهل‌کاری است گذشتن ز ثماشای بهشت   هرکه صبر از رخ خوب ثو کند ایوب است, تا ز رخ، زلف آن بهشتی روی دور انداخته است    دست رضوان پرده بر رخسار حور انداخته است,دربانی بهشت به رضوان حلال باد    آیینه‌داری رخ جانانم ارزوست,در این جهان چو دوزخ اگر بهشتی هست    که می‌توان راست کرد، تنهایی است
http://Alefba-368201247951-Zaban97__konkur.in,در کدام بیت «تشبیه و استعاره» هر دو، وجود دارد؟,4,پشت هر شادی غمی بنهفته بنگر که آسمان   ابر گریان دارد و خورشید خندان نیز هم,ز زبان سوسن آزاده‌ام آمد به گوش    کاندر این دیر کهن کار سبکباران خوش است,به تولای تو در آتش محنت چو خلبل    گوییا در چمن لاله و ریحان بودم,شکر بر خویشتن خندد گر آن ماه    به شکر خنده بگشاید دهان را
https://hamid737.blogsky.com/1390/11/22/post-15/,کدام گزینه، عنوان مشترک یبر دو مثنوی متفاوت از دوشاعر عارف «سنایی» و«عطار» است؟,1,الهی نامه,عشق نامه,مصیبت نامه,مختارنامه
Alefba-705740247951-76_Omoomi_Sample_Hoosh4__estekhdamshoo.ir,با توجه به رابطه بین کلمات فراست (ستاره) گوشواره ، کدام گزینه بجای علامت ..... مناسب است. شیراز (....) هامون ؟,1,آزمون,رازها,شیون,همراز
Alefba-084111247951-Konkur98_Zaban_NezamGhadim__konkur.in_," در عبارت زیر، چند وابسته پیشین و پسین، به‌ترتیب، وجود دارد؟
«دلم می‌خواست این نغمه آسمانی را همه بشنوند همان کلمات شورانگیز که از داناترین استاد جهان شنیدم. کاش
می‌شد یک لحظه همه را آشنا سازم.»",3,سه، پنج,چهار، سه,چهار، چهار,پنج، چهار
Alefba-042880247951-78_Omoomi_Sample_Hoosh6__estekhdamshoo.ir.docx,کدامیک از گزینه‌ها به عللی با سه گزینه دیگر فرق می‌نماید؟,1,ادراک,کارد,اردک,راکد
Alefba-428990247951-Zaban96__konkur.in_,"متن زیر با کدام بیت، تناسب مفهومی دارد؟
«سلطان سنجر را پرسیدند: «علت چه بود که ملکی بدین وسعت و آراستگی که تو را بود، چنین مختل شد؟» گفت:
«کارهای بزرگ به مردم خرد قرمودم و کارهای خرد به مردم بزرگ، هر دو کار تباه شد و نقصان به ملک رسید و ...........»",4, بزرگش نخوانند اهل خرد    کمه نام بزرگان به زشفی برد,کار دنیا که تو دشوار گرفتی بر خود    گر تو برخویشتن آسان کنی آسان گردد,بزرگ باش و مشو تنگدل ز خردی کار    که سال تا سال آرد گلی زمانه ز خار,زشت زشت است در ولایت شاه    گرگ یرگاه و یوسف اندر چاه
Alefba-976660247951-77_Omoomi_Sample_Hoosh5__estekhdamshoo.ir.docx,رابطه‌ی تنور با پختن مثل رابطه‌ی,2,میدان است با ورزش,مزرعه است باکشت,اطاق است با خوابیدن,باغ است با گردش
Alefba-345080247951-88_zaban__www.konkur.in_.docx,"مؤلف کدام اثر در برابر آن، نادرست آورده شده است؟
ارتباط ایرانی (علی مؤذّنی) - توپ (غلامحسین ساعدی) - آن جا که حق پیروز است (پرویز خرسند) - بامداد اسلام (عبدالحسین زرّین کوب) - گاو (غلامحسین ساعدی) - صفیر سیمرغ (عبدالحسین زرّین کوب)
",4,توپ,گاو,ارتباط ایرانی,صفیر سیمرغ
http://teacherofhistory.blogfa.com/post/959,کدام شاعر ایرانی جنگ های طولانی کیانیان را به نظم کشیده است؟,2,نظامی,فردوسی,سعدی,خاقانی
Alefba-705740247951-76_Omoomi_Sample_Hoosh4__estekhdamshoo.ir,انجام دادن چنین کاری ظریف و دقیق، آن هم بوسیله‌ی فردی ................. بعید به نظر می‌رسد,2,خشن,کودن,فرومایه,حقیر
https://شناسنامه.com/estekhdami/hoosh.pdf,رابطه ي آرد با نان مثل رابطه ي:,2,گوشت است با کباب,پوست است با چرم,نخ است با پشم,پنبه است با پارچه
https://شناسنامه.com/estekhdami/hoosh.pdf,متضاد کلمات مورد سؤال چیست؟ پارسایی,1,فسق,کفر,طمع,ریا
Alefba-227280247951-konkur90_Zaban__www.konkur.in_.docx,مفهوم کدام بیت با دیگر ابیات متفاوت است؟,4,ای درد و غم تو راحت دل      هم مرهم و هم جراحت دل,دردم از یاراست و درمان نیز هم       دل فدای او شد و جان نیز هم,همچونی زهری و تریاقی که دید     همچونی دمساز و مشتاقی که دید؟,دردی است درد عشق که هیچش طبیب نیست         گردردمند عشق بنالد غریب نیست
Alefba-967154147951-konkur89_Tajrobi__www.konkur.in_.docx,مؤلفان آثار «دری به خانه‌ی خورشید، آوار آفتاب، تئوری رنگ‌ها، چهل ساعت محاکمه، الحیاة» به‌ترتیب کدامند؟,4,محمدرضا حکیمی- گوته- سهراب سپهری- عبدالله مستوفی- سلمان هراتی,عبدالله مستوفی- سهراب سپهری- گوته- سلمان هراتی- محمدرضا حکیمی,سلمان هراتی- گوته- سهراب سپهری- محمدرضا حکیمی- عبدالله مستوفی,سلمان هراتی- سهراب سپهری-گوته- عبدالله مستوفی- محمدرضا حکیمی
Alefba-063180247951-89_zaban__www.konkur.in_.docx,در کدام عبارت «نقش تبعی» وجود ندارد؟,4,نثر داستانی اکنون مهم‌ترین نوع ادبی اروپا و مهم‌ترین نوع ادبی جهان امروز است و خود اقسامی دارد.,در نگاه نخست، طنز، برای شوخی وخنده است، ولی بعد روشن می‌شود که طنزنویس از نارسایی‌ها و ناروایی‌های جامعه رنج می‌برد.,"شعر انسانی به مسائل وطن‌پرستی، بشردوستی، مخالفت با استعمار وتسلط بیگانگان، محبت به فرزندان وخانواده و
آزادی‌خواهی می‌پردازد.","نکته‌ی مهمی که لزوم اخلاق جدید را مطرح می‌سازد، این است که اخلاق، از بنیادهای اجتماعی است و دارای تمام
خصوصیات این بنیادهاست."
Alefba-227280247951-konkur90_Zaban__www.konkur.in_.docx,"در عبارت «شاعر به کمک قواعد عروض و قافیه و در چار چوب سنت‌ها و روش‌های شاعری، در فرهنگ ایرانی دو ساخت تازه را بر مجموعه‌ی ساخت‌های آوایی فارسی افزوده و از این رهگذر، اثری ادبی آفریده است که می‌توان نام سخن منظوم برآن نهاد.» چند وابسته پسین وجود دارد؟
",3,شانزده,هفده,هجده,نوزده
https://hamid737.blogsky.com/1390/11/22/post-15/,سرآینده بیت زیر کیستودرباره­ چه کسی است؟اشعار زهد و پند بس گفتهاست / آن تیره چشم شاعرروشن بین,2,شهید بلخی /ابوشکور بلخی,ناصر خسرو / رودکی,عنصری / کسایی,رودکی / شهیدبلخی
Alefba-063180247951-89_zaban__www.konkur.in_.docx,در همه‌ی ابیات به جز بیت ......... هر دو آرایه‌ی کنایه و استعاره وجود دارد.,4,خیمه‌ی انس مزن بر در این کهنه رباط    که اساسش همه بی‌موقع و بی‌بنیاد است     ,چو مشک ما همه کافور شد از سردی دنیا    جوانان را ز ما دل سرد شد کو آن جوانی‌ها ,کمال مردی و مردانگی است خودشکنی    ببوس دست کسی را که این صنم شکند,هر کسی را سر چیزی و تمنای کسی است    ما به غیر تو نداریم تمنای دگر
Alefba-960269147951-62_Omoomi_Sample_Etelat_Omomi4__estekhdamshoo.ir,مشهورترین شاعر رمانتیک قرن نوزدهم فرانسه چه کسی است؟,2,ولتر,ویکتورهوگو,لافونتن,ژان ژاک  روسو
Alefba-661560247951-31_Omoomi_Sample_Hoosh2__estekhdamshoo.ir,متضاد کلمات مورد سؤال چیست؟      بدرقه,2,خوش‌آمد,استقبال,تهنیت,تعارف
https://شناسنامه.com/estekhdami/hoosh.pdf,پرتاب کردن به توپ، مثل :,3,کشتن است به فشنگ,جواب است به سوال, شلیک کردن است به گلوله,دسته است به چاقو
https://شناسنامه.com/estekhdami/hoosh.pdf,رابطه ي گمراه با ارشاد مثل رابطه ي:,4,تنبل است با تنبیه,معلم است با تدریس,زرنگ است با تشویق,مجرم است با تأدیب
https://hamid737.blogsky.com/1390/11/22/post-15/,مهمترین و طولانیترین بخش شاهنامه کداماست؟,2,بخش اساطیری,بخش پهلوانی,بخش تارخی,هیچکدام
Alefba-042880247951-78_Omoomi_Sample_Hoosh6__estekhdamshoo.ir.docx,کدام یک از چهار پاسخ زیر باید حذف شود، تا سه پاسخ دیگر از جهتی دریک طبقه قرار گیرند؟,3,دور - رود,موش - شوم,قمر - رقم,روز - زور
Alefba-705740247951-76_Omoomi_Sample_Hoosh4__estekhdamshoo.ir,کدام کلمه به معنی درندگان است؟,1,سباع,ضیاع,عقار,وحوش
https://شناسنامه.com/estekhdami/hoosh.pdf,متضاد کلمات مورد سؤال چیست؟ رام,1,سرکش,بیباك,خشن,آشفته
Alefba-227280247951-konkur90_Zaban__www.konkur.in_.docx,"در متن «اگر کسی از گناه کاران را امکان تواند بود که در مراعات جوانب لطفی به جای آرد و در طلب رضای فراغ دوستان سعی
پیوندد و در کسب منافع و دفع مضار مؤونتی و مظاهرتی واجب دارد ممکن است که آن وحشت برخیزد و هم عقیدت را صفوتی
حاصل آید.» چند غلط املایی یافت می‌شود؟",1,یک,دو ,سه ,چهار
https://hamid737.blogsky.com/1390/11/22/post-15/,«گلهای بدی»‌ اثرمشهورکدام شاعر سمبولیسم است؟,2,استفان مالارمه,شارل بودلی,ازراپوند,ژان­آرتور مبو
Alefba-976660247951-77_Omoomi_Sample_Hoosh5__estekhdamshoo.ir.docx,لباس به کمد مثل ........... است به .......,3,پا - قالی,بازیگر - سناریو,جوهر - قلم,واکس - کفش
Alefba-705740247951-76_Omoomi_Sample_Hoosh4__estekhdamshoo.ir,اهالی دو دهکده که بین آنها موانع طبیعی وجود دارد، معمولا آشنایی ................ با یکدیگر دارند,2,سطحی,اتفاقی,عمیق,خصوصی
Alefba-638944147951-88_tajrobi__www.konkur.in_.docx,در بیت: «بر در خانه منم ای مه و ای مشتری    جمله منم تو شده گشته من از من بری»، کدام گروه آرایه‌های ادبی یافت می‌شود؟,2,تشبیه- کنایه - تکرار- ایهام,کنایه- جناس- تکرار- استعاره,جناس- تشخیص- ایهام- حس‌امیزی,تشبیه- مراعات‌نظیر- کنایه - مجاز
https://hamid737.blogsky.com/1390/11/22/post-15/,درکدام اثربرای بسیار یازاصطلاحات علمی،برابرهای ­مناسب فارسی ­یافت ­می شود؟,1,هدایة­المتعلمینفی­ الطب,الابنیه عن حقایق الادویه,حدود العالم المشرق الیمغرب,چهار مقاله
Alefba-705740247951-76_Omoomi_Sample_Hoosh4__estekhdamshoo.ir,پرتاب کردن با توپ، مثل,3,کشتن است با فشنگ,جواب است با سوال,شلیک کردن است با گلوله,دسته است با چاقو
Alefba-084111247951-Konkur98_Zaban_NezamGhadim__konkur.in_,کدام عبارت، فاقد غلط املایی است؟,4,پی غولان ظلال رفتن نشان خامی و دشمن کامی باشد., رسولان سلطان در کمال ابهت و صلاح صولت از جای برخاستند., تأمل‌کنان گفت: می‌ترسم از این تربت نقل کنم و هوای قربت ما را نسازد.,خارکن را گفتش به ضیافت حاتم چرا نروی که خلقی بر سماط او گرد آمده‌اند.
https://hamid737.blogsky.com/1390/11/22/post-15/,همه گزینه­ها به جزگزینه­ .... از آثار مشهور مکتبناتورالیسم است؟,2,پیش ­ازسپیده ­دم,صد سال تنهایی,اشباح,خانه ­عروسکی
Alefba-227280247951-konkur90_Zaban__www.konkur.in_.docx,بیت: «بگفتا گر به سریابیش خشنود       بگفت از گردن این وام افکنم زود» با کدام بیت ارتباط مفهومی دارد؟,2,گرقلب دلم را ننهد دوست عیاری        من نقد روان دردمش از دیده شمارم,پروانه‌ی او گر رسدم در طلب جان      چون شمع همان دم به دمی جان بسپارم,حافظ لب لعلش چو مرا جان عزیز است          عمری بود آن لحظه که جان را به لب آرم,امروز مکش سر ز وفای من و اندیش         زان شب که من از غم به دعادست برآرم
Alefba-661560247951-31_Omoomi_Sample_Hoosh2__estekhdamshoo.ir,متضاد کلمات مورد سؤال چیست؟ اندوه,3,خوش خلقی,خوشبختی,خوشحالی,خوش‌رویی
https://شناسنامه.com/estekhdami/hoosh.pdf,رابطه ي اسب با سوارکار مثل رابطه ي:,4,هواپیما است با مسافر,تانک است با سرباز,شتر است با ساربان,فیل است با فیلبان
Alefba-705740247951-76_Omoomi_Sample_Hoosh4__estekhdamshoo.ir,متضاد طرد,1,جلب,جذب,پیوند,پشتیبانی
Alefba-661560247951-31_Omoomi_Sample_Hoosh2__estekhdamshoo.ir,متضاد کلمات مورد سؤال چیست؟   نیک سرشت,3,بدفرجام,بدکیش,بد نهاد,بد اندیشه
Alefba-345080247951-88_zaban__www.konkur.in_.docx,"عبارات زیر یا کدام بیت قرابت مفهومی دارد؟
« پس هر کسی سنگی می‌انداختند. شبلی موافقت را گلی انداخت. حسین بن منصور آهی کرد؛ گفتند:  « از این همه سنگ چرا هیچ آه نگردی، از گلی آه کردن، چه سرّ است؟» گفت: آن که آن‌ها نمی‌دانند معذورند؛ از او سختم می‌آید که می‌داند که نمی‌باید انداخت».",1,فریاد مردمان همه از دست است فریاد سعدی از دل نامهربان دوست,گر من از دوست بنالم نفسم صادق نیست خبر از دوست ندارد که ز خود با خبر است,گر دوست را به دیگری از من فراغت است من دیگری ندارم قائم مقام دوست,دست شد یارم و یاران به من اغیار شدند دوست بنگر که همه خلق جهان دشمن کرد
Alefba-705740247951-76_Omoomi_Sample_Hoosh4__estekhdamshoo.ir,آنچه که از ارزش واقعی چیزی بکاهد :؟,4,انتقاد,شایعه,فراوانی,نقص
Alefba-345080247951-88_zaban__www.konkur.in_.docx,مفهوم حدیث «العالم محضر الله لا تعصوا فی محضره.»از کدام بیت بر می‌آید؟,2,صبح امید که به معتکف پرده‌ی غیب گو برون آی که کار شب تار آخر شد,گم مشو از حضرت و جا را ببین دل به حضور آر خدا را ببین,از دست غیبت تو شکایت نمی‌کنم تا نیست غیبتی نبود لذت حضور,بر افکن برقع (نقاب) از محراب جمشید که حاجتمند برقع نیست خورشید
https://hamid737.blogsky.com/1390/11/22/post-15/,کدام شاعر سمبولیست، آثارداگار آلن پورا به زبان فرانسه ترجمه کرد؟,1,شارل پیر بودلر,ژان آرتوز مبو,استفان مالارمه,راینرماریاربلکه
Alefba-705740247951-76_Omoomi_Sample_Hoosh4__estekhdamshoo.ir,سخنرانی داوطلب ریاست شرکت پر از وعده‌های تو خالی، بازی کلمات و ............... بود,4,پندهای گرانبها,کوشش‌های بیهوده ,گفته‌های حکیمانه,مطالب سطحی
http://Alefba-368201247951-Zaban97__konkur.in,در کدام عبارت، «غلط املایی یا رسم‌الخطی» وجود دارد؟,1,عالمی معتبر را مناظره افتاد با یکی از ملحدان و حجت با او بس نیامد، سپر بیانداخت و برگشت.,چندان که ملاطفت کرد و پرسیدش از کجایی، در قعر بحر مودت جنان غریق بود که مجال نفس نداشت.,درویشی را شنیدم که در به روی از جهانیان بسنه و ملوک و اغنیا را در چشم همت او شوکت و هیبت نمانده.,"جوانی خردمند از فنون فضایل، حظی وافر داشت و طبعی نافر. چندان که در محافل دانشمندان نشستی زبان سخن
ببستی."
Alefba-084111247951-Konkur98_Zaban_NezamGhadim__konkur.in_,"آرایه‌های بیت زیر کدامند؟
«بی‌برگی ما برگ نشاط است چمن را    شیرازه گلزار بود خار و خس ما» 
",1,تشبیه، استعاره، پارادوکس، مجاز,استعاره، پارادوکس، مجاز، حسن تعلیل,تشبیه، تضاد، کنابه، اسلوب معادله, استعاره، حسن تعلیل، اسلوب معادله، مجاز
